{
  "schema_version": 1,
  "reviewer": {"client": "claude-code", "model": "claude-sonnet-5-5",
               "session": "SC-001 desarrollo. Revisión del mismo agente que escribió el fixture (sesgo conocido; ver docs/VALIDATION.md)"},
  "created_at": "2026-09-30T23:30:00Z",
  "snapshot": {"snapshot_hash": "sha256:3171e4ac8fa81bf48c445dab7c93d2b128f36be6495764241aaaaf79f50177f1"},
  "scope_reviewed": ["src/server.js", "src/auth.js", "src/view.js", "package.json"],
  "control_results": [
    {"control_id": "SEC-AUTHN-001", "status": "PASS",
     "rationale": "requireAuth usa jwt.verify (no decode) con algoritmo fijado RS256, issuer y audience explícitos; jsonwebtoken valida exp por defecto.",
     "files_examined": ["src/auth.js"],
     "limitations": "La clave pública proviene de la variable de entorno JWT_PUBLIC_KEY; su gestión y rotación no son visibles en el repositorio."},
    {"control_id": "SEC-AUTHZ-001", "status": "FAIL",
     "rationale": "GET /api/export/all-customers no pasa por ningún middleware de autenticación ni autorización y no existe un app.use(requireAuth) global que la cubra.",
     "files_examined": ["src/server.js", "src/auth.js"], "finding_refs": ["authz1"]},
    {"control_id": "SEC-AUTHZ-002", "status": "UNKNOWN",
     "rationale": "/api/orders filtra por owner_id = req.user.id (correcto), pero /api/customers no tiene un modelo de propiedad visible: no se puede concluir el acceso por objeto sin conocer el modelo de datos.",
     "files_examined": ["src/server.js"]},
    {"control_id": "SEC-INPUT-001", "status": "FAIL",
     "rationale": "La consulta de /api/customers concatena req.query.name; en cambio /api/orders y el DELETE usan parámetros posicionales ($1) correctamente.",
     "files_examined": ["src/server.js"], "finding_refs": ["sqli1"]},
    {"control_id": "SEC-INPUT-002", "status": "PASS",
     "rationale": "El único uso de innerHTML asigna una constante sin datos externos; el dato dinámico se escribe con textContent y el servidor responde JSON, no HTML.",
     "files_examined": ["src/view.js", "src/server.js"],
     "limitations": "Solo se revisaron los archivos del fixture; no hay plantillas del lado servidor."},
    {"control_id": "SEC-INPUT-003", "status": "FAIL",
     "rationale": "POST /api/calc evalúa con eval() la expresión recibida en el body: ejecución de código arbitrario por cualquier usuario autenticado.",
     "files_examined": ["src/server.js"], "finding_refs": ["eval1"]}
  ],
  "findings": [
    {"ref": "authz1", "control_id": "SEC-AUTHZ-001", "title": "Exportación de todos los clientes sin autenticación ni autorización",
     "severity": "critical", "confidence": "high", "file": "src/server.js", "start_line": 29,
     "description": "La ruta GET /api/export/all-customers devuelve id, name, email y tax_id de todos los clientes sin ningún control de acceso.",
     "flow": "GET /api/export/all-customers (sin credenciales) → handler anónimo → db.query SELECT sobre customers → respuesta JSON completa. No hay middleware global (app.use) ni guard por ruta; las demás rutas sí usan requireAuth, lo que confirma que es una omisión puntual y no una política global.",
     "evidence": "app.get('/api/export/all-customers', async (req, res) => {...}) sin requireAuth/requireRole",
     "risk": "Exposición masiva de datos personales (email, identificador fiscal) a cualquier visitante.",
     "remediation": "Agregar requireAuth y requireRole('admin') o una política equivalente; evaluar si la exportación debe existir y registrarla como evento auditable."},
    {"ref": "sqli1", "control_id": "SEC-INPUT-001", "title": "Concatenación de req.query.name en una sentencia SQL",
     "severity": "high", "confidence": "high", "file": "src/server.js", "start_line": 17,
     "description": "El parámetro name se concatena dentro de comillas simples en el SQL ejecutado por db.query sin parametrizar ni validar.",
     "flow": "GET /api/customers?name=… (usuario autenticado) → req.query.name → concatenación en 'sql' → db.query(sql). Control existente: solo autenticación; no hay validación ni parámetros.",
     "evidence": "const sql = \"SELECT id, name FROM customers WHERE name = '\" + req.query.name + \"'\";",
     "risk": "Inyección SQL: lectura o modificación de datos con los privilegios de la cuenta de la aplicación.",
     "remediation": "Usar db.query('SELECT id, name FROM customers WHERE name = $1', [req.query.name])."},
    {"ref": "eval1", "control_id": "SEC-INPUT-003", "title": "eval() sobre una expresión recibida del cliente",
     "severity": "critical", "confidence": "high", "file": "src/server.js", "start_line": 36,
     "description": "El endpoint /api/calc ejecuta eval(req.body.expression).",
     "flow": "POST /api/calc (usuario autenticado) → req.body.expression → eval → ejecución en el proceso del servidor. Sin lista permitida ni sandbox.",
     "evidence": "res.json({ result: eval(req.body.expression) });",
     "risk": "Ejecución remota de código con los privilegios del proceso por cualquier usuario autenticado.",
     "remediation": "Reemplazar por un evaluador de expresiones aritméticas restringido (parser sin ejecución de código)."}
  ]
}
